"https://svijetsluha.com/proizvodi/kategorija/profesionalna-oprema","proizvodi/kategorija/[kat]","200","yes","https://svijetsluha.com/proizvodi/kategorija/profesionalna-oprema","","Profesionalna oprema — ponuda Svijet Sluha — Svijet Sluha","Dijagnostička oprema za ordinacije i klinike — audiometri, kabine, timpanometri.","Profesionalna oprema","Product category","Product research","Medium","BreadcrumbList; ListItem; Organization; WebSite","11","33","Low","Missing from sitemap","Location-count wording drift in production baseline","Monitor or improve content depth","high"
"https://svijetsluha.com/proizvodi/kategorija/slusni-implanti","proizvodi/kategorija/[kat]","200","yes","https://svijetsluha.com/proizvodi/kategorija/slusni-implanti","","Slušni implanti — ponuda Svijet Sluha — Svijet Sluha","Cochlear™ sistemi — informacije i upiti uz stručno savjetovanje.","Slušni implanti","Product category","Product research","Medium","BreadcrumbList; ListItem; Organization; WebSite","14","36","Low","Missing from sitemap","Location-count wording drift in production baseline","Monitor or improve content depth","high"
"https://svijetsluha.com/proizvodi/novus-oae-abr-skrining","proizvodi/[slug]","200","yes","https://svijetsluha.com/proizvodi/novus-oae-abr-skrining","","OAE/ABR skrining Novus — Svijet Sluha","OAE/ABR skrining Novus","OAE/ABR skrining Novus","Product detail","Product research","Medium","BreadcrumbList; ListItem; Organization; Product; WebSite","2","24","Low","No crawl-level issue","Location-count wording drift in production baseline","Monitor or improve content depth","low"
"https://svijetsluha.com/proizvodi/nowax-filteri-za-cic-aparate-6-komada","proizvodi/[slug]","200","yes","https://svijetsluha.com/proizvodi/nowax-filteri-za-cic-aparate-6-komada","","NoWax filteri, za CIC aparate (6 komada) — Svijet Sluha","Vaš ušni kanal proizvodi ušnu mast koja može da začepi zvučnik slušnog aparata. Ušna mast je jedan od glavnih uzroka problema kod slušnih aparata. Svi CIC","NoWax filteri, za CIC aparate (6 komada)","Product detail","Product research","Medium","BreadcrumbList; ListItem; Organization; Product; WebSite","2","24","Duplicate description","No crawl-level issue","Location-count wording drift in production baseline","Monitor or improve content depth","low"
"https://svijetsluha.com/proizvodi/nucleus-kanso2-cp1150","proizvodi/[slug]","200","yes","https://svijetsluha.com/proizvodi/nucleus-kanso2-cp1150","","Nucleus Kanso2 (CP1150) — Svijet Sluha","Slušne performanse SmartSound® iQ sa SCAN ForwardFocus tehnologija sa dva mikrofona Povezivanje direktno strimovanje sa kompatibilnih Apple i Android uređa","Nucleus Kanso2 (CP1150)","Product detail","Product research","Medium","BreadcrumbList; ListItem; Organization; Product; WebSite","2","24","Low","No crawl-level issue","Location-count wording drift in production baseline","Monitor or improve content depth","low"
"https://svijetsluha.com/proizvodi/nucleus-n7-cp1000","proizvodi/[slug]","200","yes","https://svijetsluha.com/proizvodi/nucleus-n7-cp1000","","Nucleus N7 (CP1000) — Svijet Sluha","Olakšava slušanje SmartSound iQ sa SCAN sistem za upravljanje zvukom osmišljen je tako da odredi vaše slušno okruženje, donoseći stotine odluka dnevno da v","Nucleus N7 (CP1000)","Product detail","Product research","Medium","BreadcrumbList; ListItem; Organization; Product; WebSite","2","24","Low","No crawl-level issue","Location-count wording drift in production baseline","Monitor or improve content depth","low"
"https://svijetsluha.com/proizvodi/nucleus-n7s-cp1002","proizvodi/[slug]","200","yes","https://svijetsluha.com/proizvodi/nucleus-n7s-cp1002","","Nucleus N7S (CP1002) — Svijet Sluha","Osnovna tehnologija obrade zvuka - koja se automatski prilagođavaju svom okruženju Zoom tehnologija sa dva mikrofona - pomaže u filtriranju pozadinske buke","Nucleus N7S (CP1002)","Product detail","Product research","Medium","BreadcrumbList; ListItem; Organization; Product; WebSite","2","24","Low","No crawl-level issue","Location-count wording drift in production baseline","Monitor or improve content depth","low"
"https://svijetsluha.com/proizvodi/nucleus-n8-cp1110","proizvodi/[slug]","200","yes","https://svijetsluha.com/proizvodi/nucleus-n8-cp1110","","Nucleus N8 (CP1110) — Svijet Sluha","Udobnost najmanji i najlakši zaušni procesor zvuka za kohlearni implant novi udoban oblik Slušne performanse SmartSound® iQ 2 - pametnija tehnologija za po","Nucleus N8 (CP1110)","Product detail","Product research","Medium","BreadcrumbList; ListItem; Organization; Product; WebSite","2","24","Low","No crawl-level issue","Location-count wording drift in production baseline","Monitor or improve content depth","low"
"https://svijetsluha.com/proizvodi/pello-audiometar","proizvodi/[slug]","200","yes","https://svijetsluha.com/proizvodi/pello-audiometar","","Audiometar Pello — Svijet Sluha","Četiri opcije konfiguracija omogućavaju svakom objektu da prilagođava i usklađuje funkcije na osnovu klinike i potreba pacijenta.","Audiometar Pello","Product detail","Product research","Medium","BreadcrumbList; ListItem; Organization; Product; WebSite","2","24","Low","No crawl-level issue","Location-count wording drift in production baseline","Monitor or improve content depth","low"
"https://svijetsluha.com/proizvodi/prowax-minifit-filteri-za-bernafon-rite-aprate-6-komada","proizvodi/[slug]","200","yes","https://svijetsluha.com/proizvodi/prowax-minifit-filteri-za-bernafon-rite-aprate-6-komada","","ProWax minifit filteri, za Bernafon RITE aprate (6 komada) — Svijet Sluha","Vaš ušni kanal proizvodi ušnu mast koja može da začepi zvučnik slušnog aparata. Ušna mast je jedan od glavnih uzroka problema kod slušnih aparata. Svi CIC","ProWax minifit filteri, za Bernafon RITE aprate (6 komada)","Product detail","Product research","Medium","BreadcrumbList; ListItem; Organization; Product; WebSite","2","24","Duplicate description","No crawl-level issue","Location-count wording drift in production baseline","Monitor or improve content depth","low"
"https://svijetsluha.com/proizvodi/pumpica-za-ciscenje-individualnih-oliva","proizvodi/[slug]","200","yes","https://svijetsluha.com/proizvodi/pumpica-za-ciscenje-individualnih-oliva","","Pumpica za čišćenje individualnih oliva — Svijet Sluha","Ostaci ušne masti-cerumena i preostale tečnosti se lako i temeljno uklanjaju iz cevčice kojom je slušni aparat povezan sa individualnim umetkom ili iz zavo","Pumpica za čišćenje individualnih oliva","Product detail","Product research","Medium","BreadcrumbList; ListItem; Organization; Product; WebSite","2","24","Low","No crawl-level issue","Location-count wording drift in production baseline","Monitor or improve content depth","low"
"https://svijetsluha.com/proizvodi/tympstar-pro-timpanometar","proizvodi/[slug]","200","yes","https://svijetsluha.com/proizvodi/tympstar-pro-timpanometar","","Timpanometar Tympstar Pro — Svijet Sluha","Protokoli se mogu konfigurirati na timpanometru kako bi se optimizirala efikasnost i radni tok; fleksibilnost unapred definisanih protokola štedi vreme i s","Timpanometar Tympstar Pro","Product detail","Product research","Medium","BreadcrumbList; ListItem; Organization; Product; WebSite","2","24","Low","No crawl-level issue","Location-count wording drift in production baseline","Monitor or improve content depth","low"
"https://svijetsluha.com/proizvodi/varta-power-one-velicina-10-6kom","proizvodi/[slug]","200","yes","https://svijetsluha.com/proizvodi/varta-power-one-velicina-10-6kom","","Varta Power One veličina 10 (6kom) — Svijet Sluha","Sve Power One baterije sa cink-vazduhom su bez žive, što omogućava kompaniji Varta da opravda svoju tvrdnju da je ekološki najprihvatljiviji proizvođač bat","Varta Power One veličina 10 (6kom)","Product detail","Product research","Medium","BreadcrumbList; ListItem; Organization; Product; WebSite","2","24","Duplicate description","No crawl-level issue","Location-count wording drift in production baseline","Monitor or improve content depth","low"
"https://svijetsluha.com/proizvodi/varta-power-one-velicina-13-6kom","proizvodi/[slug]","200","yes","https://svijetsluha.com/proizvodi/varta-power-one-velicina-13-6kom","","Varta Power One veličina 13 (6kom) — Svijet Sluha","Sve Power One baterije sa cink-vazduhom su bez žive, što omogućava kompaniji Varta da opravda svoju tvrdnju da je ekološki najprihvatljiviji proizvođač bat","Varta Power One veličina 13 (6kom)","Product detail","Product research","Medium","BreadcrumbList; ListItem; Organization; Product; WebSite","2","24","Duplicate description","No crawl-level issue","Location-count wording drift in production baseline","Monitor or improve content depth","low"
"https://svijetsluha.com/proizvodi/varta-power-one-velicina-312-6kom","proizvodi/[slug]","200","yes","https://svijetsluha.com/proizvodi/varta-power-one-velicina-312-6kom","","Varta Power One veličina 312 (6kom) — Svijet Sluha","Sve Power One baterije sa cink-vazduhom su bez žive, čime kompanija Varta opravdava svoju tvrdnju da je ekološki najprihvatljiviji proizvođač baterija za s","Varta Power One veličina 312 (6kom)","Product detail","Product research","Medium","BreadcrumbList; ListItem; Organization; Product; WebSite","2","24","Duplicate description","No crawl-level issue","Location-count wording drift in production baseline","Monitor or improve content depth","low"
"https://svijetsluha.com/proizvodi/varta-power-one-velicina-675-6kom","proizvodi/[slug]","200","yes","https://svijetsluha.com/proizvodi/varta-power-one-velicina-675-6kom","","Varta Power One veličina 675 (6kom) — Svijet Sluha","Sve Power One baterije sa cink-vazduhom su bez žive, čime kompanija Varta opravdava svoju tvrdnju da je ekološki najprihvatljiviji proizvođač baterija za s","Varta Power One veličina 675 (6kom)","Product detail","Product research","Medium","BreadcrumbList; ListItem; Organization; Product; WebSite","2","24","Duplicate description","No crawl-level issue","Location-count wording drift in production baseline","Monitor or improve content depth","low"
"https://svijetsluha.com/savjeti","savjeti","200","yes","https://svijetsluha.com/savjeti","","Savjeti i novosti o sluhu — Svijet Sluha","Praktični savjeti o sluhu i slušnim aparatima, novosti iz naših poslovnica i vijesti iz Sarajeva.","Savjeti i novosti","Advice hub","Informational/AEO","Medium","BreadcrumbList; ListItem; Organization; WebSite","98","30","Duplicate title","No crawl-level issue","Location-count wording drift in production baseline","Monitor or improve content depth","low"
"https://svijetsluha.com/savjeti?kategorija=novosti","savjeti","200","yes","https://svijetsluha.com/savjeti","","Savjeti i novosti o sluhu — Svijet Sluha","Praktični savjeti o sluhu i slušnim aparatima, novosti iz naših poslovnica i vijesti iz Sarajeva.","Savjeti i novosti","Advice article","Informational/AEO","Medium","BreadcrumbList; ListItem; Organization; WebSite","4","26","Query duplicate","Indexable query state","Location-count wording drift in production baseline","Noindex query-state URL","high"
"https://svijetsluha.com/savjeti?kategorija=sarajevo","savjeti","200","yes","https://svijetsluha.com/savjeti","","Savjeti i novosti o sluhu — Svijet Sluha","Praktični savjeti o sluhu i slušnim aparatima, novosti iz naših poslovnica i vijesti iz Sarajeva.","Savjeti i novosti","Advice article","Informational/AEO","Medium","BreadcrumbList; ListItem; Organization; WebSite","4","27","Query duplicate","Indexable query state","Location-count wording drift in production baseline","Noindex query-state URL","high"
"https://svijetsluha.com/savjeti?kategorija=savjeti","savjeti","200","yes","https://svijetsluha.com/savjeti","","Savjeti i novosti o sluhu — Svijet Sluha","Praktični savjeti o sluhu i slušnim aparatima, novosti iz naših poslovnica i vijesti iz Sarajeva.","Savjeti i novosti","Advice article","Informational/AEO","Medium","BreadcrumbList; ListItem; Organization; WebSite","4","29","Query duplicate","Indexable query state","Location-count wording drift in production baseline","Noindex query-state URL","high"
"https://svijetsluha.com/savjeti/otvaranje-poslovnice-sarajevo","savjeti/[slug]","200","yes","https://svijetsluha.com/savjeti/otvaranje-poslovnice-sarajevo","","Audio BM stigao u Sarajevo — dobro došli! — Svijet Sluha","Nakon više od 30 godina rada, s ponosom otvaramo vrata naše prve poslovnice u Sarajevu. Zakažite besplatnu provjeru sluha već danas.","Audio BM stigao u Sarajevo — dobro došli!","Branch detail","Local branch/service","High","Article; BreadcrumbList; ListItem; Organization; WebSite","2","23","Low","No crawl-level issue","CMS placeholders found in production baseline; Location-count wording drift in production baseline","Monitor or improve content depth","low"
"https://svijetsluha.com/savjeti/pet-savjeta-odrzavanje-slusnog-aparata","savjeti/[slug]","200","yes","https://svijetsluha.com/savjeti/pet-savjeta-odrzavanje-slusnog-aparata","","Pet savjeta za duži vijek Vašeg slušnog aparata — Svijet Sluha","Slušni aparat je mali, precizan uređaj koji radi po cijeli dan. Uz ovih pet navika služiće Vas godinama.","Pet savjeta za duži vijek Vašeg slušnog aparata","Advice article","Informational/AEO","Medium","Article; BreadcrumbList; ListItem; Organization; WebSite","4","25","Low","No crawl-level issue","Location-count wording drift in production baseline","Monitor or improve content depth","low"
"https://svijetsluha.com/savjeti/prvi-znakovi-slabljenja-sluha","savjeti/[slug]","200","yes","https://svijetsluha.com/savjeti/prvi-znakovi-slabljenja-sluha","","Kako prepoznati prve znakove slabljenja sluha — Svijet Sluha","Slabljenje sluha dolazi postepeno, pa ga je lako previdjeti. Ovo su znakovi na koje treba obratiti pažnju — kod sebe i kod najbližih.","Kako prepoznati prve znakove slabljenja sluha","Advice article","Informational/AEO","Medium","Article; BreadcrumbList; ListItem; Organization; WebSite","4","25","Low","No crawl-level issue","Location-count wording drift in production baseline","Monitor or improve content depth","low"
"https://svijetsluha.com/savjeti/tuzla1","savjeti/[slug]","200","yes","https://svijetsluha.com/savjeti/tuzla1","","AudioBM Tuzla otvaranje — Svijet Sluha","jjjjjjjjjjjjjjj","AudioBM Tuzla otvaranje","Advice article","Informational/AEO","Medium","Article; BreadcrumbList; ListItem; Organization; WebSite","4","25","Low","No crawl-level issue","Location-count wording drift in production baseline","Monitor or improve content depth","low"
"https://svijetsluha.com/slusni-aparati","slusni-aparati","200","yes","https://svijetsluha.com/slusni-aparati","","Slušni aparati — vrste, brendovi i kako odabrati — Svijet Sluha","Kanalni, zaušni i snažni slušni aparati Bernafon i Unitron. Saznajte koji je pravi za Vas — uz besplatno savjetovanje u 6 gradova BiH.","Slušni aparati","Hearing-aid page","Commercial hearing-aid research","High","BreadcrumbList; ListItem; Organization; WebSite","98","38","Low","No crawl-level issue","Location-count wording drift in production baseline","Monitor or improve content depth","low"
"https://svijetsluha.com/slusni-aparati/kanalni","slusni-aparati/[tip]","200","yes","https://svijetsluha.com/slusni-aparati/kanalni","","Kanalni slušni aparati — modeli i savjetovanje — Svijet Sluha","Gotovo nevidljivi — sva elektronika u ušnom umetku, po mjeri. Pogledajte modele i zakažite besplatno savjetovanje u našim poslovnicama.","Kanalni slušni aparati","Hearing-aid page","Commercial hearing-aid research","High","BreadcrumbList; ListItem; Organization; WebSite","2","23","Low","No crawl-level issue","Location-count wording drift in production baseline","Monitor or improve content depth","low"
"https://svijetsluha.com/slusni-aparati/modeli/alpha-3-slusni-aparati","slusni-aparati/modeli/[slug]","200","yes","https://svijetsluha.com/slusni-aparati/modeli/alpha-3-slusni-aparati","","Alpha 3 slušni aparat — Svijet Sluha","Ovo je slušni aparat koji ima opciju punjivih baterija kao i svi slušni aparati iz porodice Alpha. Baterija se puni samo 3 sata i traje čitav dan. Za osobe","Alpha 3 slušni aparat","Hearing-aid page","Commercial hearing-aid research","High","BreadcrumbList; ListItem; Organization; Product; WebSite","3","25","Low","No crawl-level issue","Location-count wording drift in production baseline","Monitor or improve content depth","low"
"https://svijetsluha.com/slusni-aparati/modeli/alpha-5-slusni-aparati","slusni-aparati/modeli/[slug]","200","yes","https://svijetsluha.com/slusni-aparati/modeli/alpha-5-slusni-aparati","","Alpha 5 slušni aparat — Svijet Sluha","Sa slušnim aparatima Alpha 5 dobijate: Odličan fokus na govor u velikom broju okruženja Prijatnost u buci srednjeg intenziteta Opciju punjivog slušnog apar","Alpha 5 slušni aparat","Hearing-aid page","Commercial hearing-aid research","High","BreadcrumbList; ListItem; Organization; Product; WebSite","3","25","Low","No crawl-level issue","Location-count wording drift in production baseline","Monitor or improve content depth","low"
"https://svijetsluha.com/slusni-aparati/modeli/alpha-9-slusni-aparati","slusni-aparati/modeli/[slug]","200","yes","https://svijetsluha.com/slusni-aparati/modeli/alpha-9-slusni-aparati","","Alpha 9 slušni aparat — Svijet Sluha","Alpha 9 su slušni aparati koji automatski oblikuju okruženja da budu najbolja za vaš sluh. Šta to znači? Ovi slušni aparati procjenjuju kakva je buka u okr","Alpha 9 slušni aparat","Hearing-aid page","Commercial hearing-aid research","High","BreadcrumbList; ListItem; Organization; Product; WebSite","3","25","Low","No crawl-level issue","Location-count wording drift in production baseline","Monitor or improve content depth","low"
"https://svijetsluha.com/slusni-aparati/modeli/alpha1-slusni-aparati","slusni-aparati/modeli/[slug]","200","yes","https://svijetsluha.com/slusni-aparati/modeli/alpha1-slusni-aparati","","Alpha 1 slušni aparat — Svijet Sluha","Baterija se puni samo 3 sata i traje cijeli dan. Za osobe koje tradicionalno vjeruju standardnim baterijama, postoje modeli koji koriste i standardne zamje","Alpha 1 slušni aparat","Hearing-aid page","Commercial hearing-aid research","High","BreadcrumbList; ListItem; Organization; Product; WebSite","3","25","Low","No crawl-level issue","Location-count wording drift in production baseline","Monitor or improve content depth","low"
"https://svijetsluha.com/slusni-aparati/modeli/entra-1-slusni-aparat","slusni-aparati/modeli/[slug]","200","yes","https://svijetsluha.com/slusni-aparati/modeli/entra-1-slusni-aparat","","Entra 1 slušni aparat — Svijet Sluha","Razumijevanje govora – Bernafonova jedinstvena ChannelFree™ obrada signala je ključ čistog i prirodnog zvuka. Sistem analizira dolazeći signal u cijelosti","Entra 1 slušni aparat","Hearing-aid page","Commercial hearing-aid research","High","BreadcrumbList; ListItem; Organization; Product; WebSite","3","25","Low","No crawl-level issue","Location-count wording drift in production baseline","Monitor or improve content depth","low"
"https://svijetsluha.com/slusni-aparati/modeli/inizia-1-slusni-aparat","slusni-aparati/modeli/[slug]","200","yes","https://svijetsluha.com/slusni-aparati/modeli/inizia-1-slusni-aparat","","Inizia 1 slušni aparat — Svijet Sluha","Inizia 1 nudi tehnologiju koja se najviše preporučuje osobama koje nisu previše aktivne i kojima je primarno funkcionisanje u tihom okruženju, opremljen je","Inizia 1 slušni aparat","Hearing-aid page","Commercial hearing-aid research","High","BreadcrumbList; ListItem; Organization; Product; WebSite","3","25","Low","No crawl-level issue","Location-count wording drift in production baseline","Monitor or improve content depth","low"
"https://svijetsluha.com/slusni-aparati/modeli/leox-3-slusni-aparati","slusni-aparati/modeli/[slug]","200","yes","https://svijetsluha.com/slusni-aparati/modeli/leox-3-slusni-aparati","","Leox 3 slušni aparat — Svijet Sluha","Ponoseći se jednim od najviših nivoa amplifikacije na tržištu, Leox pomaže djeci i mladima da uživaju u životu punom spontanosti. Sa ovim aparatom, vi ćete","Leox 3 slušni aparat","Hearing-aid page","Commercial hearing-aid research","High","BreadcrumbList; ListItem; Organization; Product; WebSite","3","25","Low","No crawl-level issue","Location-count wording drift in production baseline","Monitor or improve content depth","low"
"https://svijetsluha.com/slusni-aparati/modeli/leox-7-slusni-aparati","slusni-aparati/modeli/[slug]","200","yes","https://svijetsluha.com/slusni-aparati/modeli/leox-7-slusni-aparati","","Leox 7 slušni aparat — Svijet Sluha","Pored mnogih opcija i dodataka, Leox je idealno rješenje za pedijatrijsko podešavanje. Ponoseći se jednim od najviših nivoa amplifikacije na tržištu, Leox","Leox 7 slušni aparat","Hearing-aid page","Commercial hearing-aid research","High","BreadcrumbList; ListItem; Organization; Product; WebSite","3","25","Low","No crawl-level issue","Location-count wording drift in production baseline","Monitor or improve content depth","low"
"https://svijetsluha.com/slusni-aparati/modeli/nevara-1-slusni-aparat","slusni-aparati/modeli/[slug]","200","yes","https://svijetsluha.com/slusni-aparati/modeli/nevara-1-slusni-aparat","","Nevara 1 slušni aparat — Svijet Sluha","Nevara 1 ima mogućnost blagog smanjivanja buke u okruženju sa funkcijom adaptive noise reduction i fokusiranja na razgovor koji dolazi ispred korisnika slu","Nevara 1 slušni aparat","Hearing-aid page","Commercial hearing-aid research","High","BreadcrumbList; ListItem; Organization; Product; WebSite","3","25","Low","No crawl-level issue","Location-count wording drift in production baseline","Monitor or improve content depth","low"
"https://svijetsluha.com/slusni-aparati/modeli/vivante-1-slusni-aparat","slusni-aparati/modeli/[slug]","200","yes","https://svijetsluha.com/slusni-aparati/modeli/vivante-1-slusni-aparat","","Vivante 1 slušni aparat — Svijet Sluha","Vivante 1 je napravlje na najnovijoj platformi kompanije Unitron sa funkcijama koje se nalaze i u nekim kvalitetnijim slušnim aparatima. Izrađuje se sa sta","Vivante 1 slušni aparat","Hearing-aid page","Commercial hearing-aid research","High","BreadcrumbList; ListItem; Organization; Product; WebSite","3","25","Low","No crawl-level issue","Location-count wording drift in production baseline","Monitor or improve content depth","low"
"https://svijetsluha.com/slusni-aparati/modeli/vivante-3-slusni-aparat","slusni-aparati/modeli/[slug]","200","yes","https://svijetsluha.com/slusni-aparati/modeli/vivante-3-slusni-aparat","","Vivante 3 slušni aparat — Svijet Sluha","Vivante 3 je napravlje na najnovijoj platformi kompanije Unitron sa funkcijama koje se nalaze i u nekim kvalitetnijim slušnim aparatima. Izrađuje se sa sta","Vivante 3 slušni aparat","Hearing-aid page","Commercial hearing-aid research","High","BreadcrumbList; ListItem; Organization; Product; WebSite","3","25","Low","No crawl-level issue","Location-count wording drift in production baseline","Monitor or improve content depth","low"
"https://svijetsluha.com/slusni-aparati/modeli/zerena-1-slusni-aparati","slusni-aparati/modeli/[slug]","200","yes","https://svijetsluha.com/slusni-aparati/modeli/zerena-1-slusni-aparati","","Zerena 1 slušni aparat — Svijet Sluha","Razumevanje govora – Bernafonova jedinstvena ChannelFree™ obrada signala je ključ čistog i prirodnog zvuka. Sistem analizira dolazeći signal u celosti i pr","Zerena 1 slušni aparat","Hearing-aid page","Commercial hearing-aid research","High","BreadcrumbList; ListItem; Organization; Product; WebSite","3","25","Low","No crawl-level issue","Location-count wording drift in production baseline","Monitor or improve content depth","low"
"https://svijetsluha.com/slusni-aparati/zausni","slusni-aparati/[tip]","200","yes","https://svijetsluha.com/slusni-aparati/zausni","","Zaušni slušni aparati — modeli i savjetovanje — Svijet Sluha","Tanki i elegantni, skriveni iza uha, uz Bluetooth povezivanje. Pogledajte modele i zakažite besplatno savjetovanje u našim poslovnicama.","Zaušni slušni aparati","Hearing-aid page","Commercial hearing-aid research","High","BreadcrumbList; ListItem; Organization; WebSite","14","35","Low","No crawl-level issue","Location-count wording drift in production baseline","Monitor or improve content depth","low"
"https://svijetsluha.com/slusni-aparati/zausni-snazni","slusni-aparati/[tip]","200","yes","https://svijetsluha.com/slusni-aparati/zausni-snazni","","Zaušni aparati za teža oštećenja — modeli i savjetovanje — Svijet Sluha","Snažniji zvuk i bolje razumijevanje govora kod težih gubitaka sluha. Pogledajte modele i zakažite besplatno savjetovanje u našim poslovnicama.","Zaušni aparati za teža oštećenja","Hearing-aid page","Commercial hearing-aid research","High","BreadcrumbList; ListItem; Organization; WebSite","2","23","Low","No crawl-level issue","Location-count wording drift in production baseline","Monitor or improve content depth","low"
"https://svijetsluha.com/tim","/tim","200","yes","https://svijetsluha.com/tim","","Naš tim — stručnjaci za sluh — Svijet Sluha","Upoznajte akustičare i stručnjake našeg tima u Sarajevu, Banjoj Luci, Gradišci, Bijeljini, Doboju i Brčkom.","Naš tim","General","Brand/trust/support","Low","BreadcrumbList; ListItem; Organization; WebSite","98","23","Low","No crawl-level issue","Location-count wording drift in production baseline","Monitor or improve content depth","low"
